{
  "$schema": "https://json-schema.org/draft/2020-12/schema",
  "title": "Test Evidence v2 (declared run provenance)",
  "type": "object",
  "additionalProperties": false,
  "required": [
    "schema_version",
    "test_id",
    "platform",
    "result",
    "source_revision",
    "observations",
    "run_provenance"
  ],
  "properties": {
    "schema_version": {
      "const": 2
    },
    "test_id": {
      "type": "string",
      "minLength": 1
    },
    "platform": {
      "type": "string",
      "minLength": 1
    },
    "result": {
      "enum": [
        "PASS",
        "FAIL",
        "BLOCKED",
        "SKIP"
      ]
    },
    "reason": {
      "type": "string"
    },
    "source_revision": {
      "type": "string",
      "minLength": 1
    },
    "observations": {
      "type": "array",
      "items": {
        "type": "object",
        "additionalProperties": false,
        "required": [
          "key",
          "value"
        ],
        "properties": {
          "key": {
            "type": "string",
            "minLength": 1
          },
          "value": {
            "type": "string"
          }
        }
      }
    },
    "run_provenance": {
      "type": "object",
      "additionalProperties": false,
      "required": [
        "runner_version",
        "source_commit",
        "environment",
        "started_at",
        "finished_at",
        "artifacts",
        "traces"
      ],
      "properties": {
        "runner_version": {
          "type": "string",
          "minLength": 1,
          "pattern": "\\S"
        },
        "source_commit": {
          "type": "string",
          "pattern": "^[0-9a-f]{40}$"
        },
        "environment": {
          "type": "object",
          "additionalProperties": {
            "type": "string"
          },
          "required": [
            "os",
            "arch"
          ],
          "properties": {
            "os": {
              "type": "string",
              "minLength": 1
            },
            "arch": {
              "type": "string",
              "minLength": 1
            }
          }
        },
        "started_at": {
          "type": "string",
          "format": "date-time"
        },
        "finished_at": {
          "type": "string",
          "format": "date-time"
        },
        "artifacts": {
          "type": "array",
          "items": {
            "type": "string",
            "minLength": 1
          },
          "uniqueItems": true
        },
        "traces": {
          "type": "array",
          "items": {
            "type": "string",
            "minLength": 1
          },
          "uniqueItems": true
        }
      }
    }
  },
  "allOf": [
    {
      "if": {
        "properties": {
          "result": {
            "enum": [
              "FAIL",
              "BLOCKED",
              "SKIP"
            ]
          }
        },
        "required": [
          "result"
        ]
      },
      "then": {
        "required": [
          "reason"
        ],
        "properties": {
          "reason": {
            "type": "string",
            "minLength": 1,
            "pattern": "\\S"
          }
        }
      }
    }
  ]
}
